#FILE	SEQUENCE	START	END	STRAND	GENE	COVERAGE	COVERAGE_MAP	GAPS	%COVERAGE	%IDENTITY	DATABASE	ACCESSION	PRODUCT	RESISTANCE
573.12862_contigs.fasta	573.12862_C1	255910	256329	-	FosA6	1-420/420	===============	0/0	100.00	98.81	card	KU254579.1:59421-59841	fosA6 is a plasmid-encoded enzyme that confers resistance to fosfomycin in Escherichia coli by breaking the epoxide ring of the molecule.	fosfomycin
573.12862_contigs.fasta	573.12862_C10	48442	51555	+	acrD	1-3114/3114	========/======	2/6	99.90	80.17	card	AP009048.1:2586250-2589364	AcrD is an aminoglycoside efflux pump expressed in E. coli. Its expression can be induced by indole and is regulated by baeRS and cpxAR.	aminoglycoside
573.12862_contigs.fasta	573.12862_C11	104393	104797	+	H-NS	1-405/414	===============	0/0	97.83	87.16	card	BA000007.3:1738104-1737690	H-NS is a histone-like protein involved in global gene regulation in Gram-negative bacteria. It is a repressor of the membrane fusion protein genes acrE mdtE and emrK as well as nearby genes of many RND-type multidrug exporters.	cephalosporin;cephamycin;fluoroquinolone;macrolide;penam;tetracycline
573.12862_contigs.fasta	573.12862_C19	42180	43546	+	cpxA	1-1367/1374	===============	0/0	99.49	82.08	card	BA000007.3:4905062-4903688	CpxA is a membrane-localized sensor kinase that is activated by envelope stress. It starts a kinase cascade that activates CpxR which promotes efflux complex expression.	aminocoumarin;aminoglycoside
573.12862_contigs.fasta	573.12862_C2	228135	229883	-	msbA	1-1749/1749	===============	0/0	100.00	80.62	card	U00096.3:966620-968369	MsbA is a multidrug resistance transporter homolog from E. coli and belongs to a superfamily of transporters that contain an adenosine triphosphate (ATP) binding cassette (ABC) which is also called a nucleotide-binding domain (NBD). MsbA is a member of the MDR-ABC transporter group by sequence homology. MsbA transports lipid A a major component of the bacterial outer cell membrane and is the only bacterial ABC transporter that is essential for cell viability.	nitroimidazole
573.12862_contigs.fasta	573.12862_C22	30746	31921	+	oqxA	1-1176/1176	===============	0/0	100.00	100.00	card	EU370913.1:46651-47827	RND efflux pump conferring resistance to fluoroquinolone	diaminopyrimidine;fluoroquinolone;glycylcycline;nitrofuran;tetracycline
573.12862_contigs.fasta	573.12862_C22	31945	35097	+	oqxB	1-3153/3153	===============	0/0	100.00	100.00	card	EU370913.1:47850-51003	RND efflux pump conferring resistance to fluoroquinolone	diaminopyrimidine;fluoroquinolone;glycylcycline;nitrofuran;tetracycline
573.12862_contigs.fasta	573.12862_C22	79367	79876	+	emrR	1-510/531	===============	0/0	96.05	83.14	card	U00096.3:2810769-2811300	EmrR is a negative regulator for the EmrAB-TolC multidrug efflux pump in E. coli. Mutations lead to EmrAB-TolC overexpression.	fluoroquinolone
573.12862_contigs.fasta	573.12862_C22	80023	81195	+	Klebsiella_pneumoniae_KpnG	1-1173/1173	===============	0/0	100.00	99.49	card	ACWO01000051.1:22092-23265	KpnG consists of ~390 residues and resembles EmrA of E. coli. Disruption of the pump components KpnG-KpnH signficantly decrease resistance to azithromycin ceftazidime ciprofloxacin ertapenem erythromycin gentamicin imipenem ticarcillin norfloxacin polymyxin-B piperacillin spectinomycin tobramycin and streptomycin	aminoglycoside;carbapenem;cephalosporin;fluoroquinolone;macrolide;penam;penem;peptide
573.12862_contigs.fasta	573.12862_C22	81211	82749	+	Klebsiella_pneumoniae_KpnH	1-1539/1539	========/======	2/2	99.94	84.22	card	ASTU01000063.1:61248-62787	KpnH consists of ~511 residues resembles EmrB of E. coli and is probably a translocase in the KpnGH-TolC efflux protein in K. pneumoniae. Disruption of the pump components KpnG-KpnH signficantly decrease resistance to azithromycin ceftazidime ciprofloxacin ertapenem erythromycin gentamicin imipenem ticarcillin norfloxacin polymyxin-B piperacillin spectinomycin tobramycin and streptomycin.	aminoglycoside;carbapenem;cephalosporin;fluoroquinolone;macrolide;penam;penem;peptide
573.12862_contigs.fasta	573.12862_C29	282	1187	+	mphA	1-906/906	===============	0/0	100.00	100.00	card	D16251.1:2531-1625	The mphA gene encodes for resistance enzyme MPH(2')-I which preferentially inactivate 14-membered macrolides (e.g.erythromycin telithromycin roxithromycin) over 16-membered macrolides (e.g.tylosin spiramycin). It phosphorylates macrolides at 2'-OH hydroxyl of desosamine sugar of macrolides in a GTP-dependent manner.	macrolide
573.12862_contigs.fasta	573.12862_C29	6498	7337	-	sul1	1-840/840	===============	0/0	100.00	100.00	card	JF969163:1053-1893	Sul1 is a sulfonamide resistant dihydropteroate synthase of Gram-negative bacteria. It is linked to other resistance genes of class 1 integrons.	sulfonamide
573.12862_contigs.fasta	573.12862_C29	7842	8621	-	aadA2	1-780/780	===============	0/0	100.00	99.87	card	AF156486:5012-5792	aadA2 is an aminoglycoside nucleotidyltransferase gene encoded by plasmids and integrons in K. pneumoniae Salmonella spp. Corynebacterium glutamicum C. freundii and Aeromonas spp.	aminoglycoside
573.12862_contigs.fasta	573.12862_C29	9041	9538	-	dfrA12	1-498/498	===============	0/0	100.00	100.00	card	GU585907.1:22103-21605	dfrA12 is an integron-encoded dihydrofolate reductase found in Vibrio cholerae	diaminopyrimidine
573.12862_contigs.fasta	573.12862_C29	15549	16208	-	catI	1-660/660	===============	0/0	100.00	99.85	card	V00622:243-903	catI is a chromosome and transposon-encoded variant of the cat gene found in Escherichia coli and Acinetobacter baumannii	phenicol
573.12862_contigs.fasta	573.12862_C3	160878	164022	-	acrB	1-3148/3150	========/======	5/9	99.75	83.85	card	U00096.3:484403-481253	Protein subunit of AcrA-AcrB-TolC multidrug efflux complex. AcrB functions as a herterotrimer which forms the inner membrane component and is primarily responsible for substrate recognition and energy transduction by acting as a drug/proton antiporter.	cephalosporin;fluoroquinolone;glycylcycline;penam;phenicol;rifamycin;tetracycline;triclosan
573.12862_contigs.fasta	573.12862_C3	164045	165238	-	Klebsiella_pneumoniae_acrA	1-1197/1197	========/======	2/3	99.75	97.74	card	AJ318073.1:793-1990	AcrA is a subunit of the AcrAB multidrug efflux system that in K. pneumoniae which is encoded by the acrRAB operon.	cephalosporin;fluoroquinolone;glycylcycline;penam;phenicol;rifamycin;tetracycline;triclosan
573.12862_contigs.fasta	573.12862_C32	20163	20531	-	marA	1-369/384	===============	0/0	96.09	81.57	card	AP009048.1:1621287-1621671	In the presence of antibiotic stress E. coli overexpresses the global activator protein MarA which besides inducing MDR efflux pump AcrAB also down- regulates synthesis of the porin OmpF.	carbapenem;cephalosporin;cephamycin;fluoroquinolone;glycylcycline;monobactam;penam;penem;phenicol;rifamycin;tetracycline;triclosan
573.12862_contigs.fasta	573.12862_C34	12662	13374	-	baeR	1-713/723	===============	0/0	98.62	81.35	card	AP009048.1:2166412-2167135	BaeR is a response regulator that promotes the expression of MdtABC and AcrD efflux complexes.	aminocoumarin;aminoglycoside
573.12862_contigs.fasta	573.12862_C34	16263	19340	-	mdtC	1-3078/3078	===============	0/0	100.00	81.58	card	U00096:2158385-2161463	MdtC is a transporter that forms a heteromultimer complex with MdtB to form a multidrug transporter. MdtBC is part of the MdtABC-TolC efflux complex. In the absence of MdtB MdtC can form a homomultimer complex that results in a functioning efflux complex with a narrower drug specificity. mdtC corresponds to 3 loci in Pseudomonas aeruginosa PAO1 (gene name: muxC/muxB) and 3 loci in Pseudomonas aeruginosa LESB58.	aminocoumarin
573.12862_contigs.fasta	573.12862_C34	19341	22463	-	mdtB	1-3123/3123	========/======	2/4	99.94	81.12	card	U00096:2155262-2158385	MdtB is a transporter that forms a heteromultimer complex with MdtC to form a multidrug transporter. MdtBC is part of the MdtABC-TolC efflux complex.	aminocoumarin
573.12862_contigs.fasta	573.12862_C65	24	884	+	SHV-134	1-861/861	===============	0/0	100.00	99.88	card	HM559945:0-861	SHV-134 is an extended-spectrum beta-lactamase.	carbapenem;cephalosporin;penam
573.12862_contigs.fasta	573.12862_C78	352	1165	-	APH(3')-Ia	1-814/816	===============	0/0	99.75	99.39	card	BX664015.1:103833-103017	APH(3')-Ia is a transposon-encoded aminoglycoside phosphotransferase in E. coli and S. enterica. It is identical at the protein sequence to APH(3')-Ic an aminoglycoside phosphotransferase encoded by plasmids transposons and genomic islands in K. pneumoniae A. baumannii S. marcescens Corynebacterium spp. Photobacterium spp. and Citrobacter spp.	aminoglycoside
573.12862_contigs.fasta	573.12862_C8	15253	15885	+	CRP	1-633/633	===============	0/0	100.00	88.15	card	AP009048.1:4154296-4153663	CRP is a global regulator that represses MdtEF multidrug efflux pump expression.	fluoroquinolone;macrolide;penam
573.12862_contigs.fasta	573.12862_C9	11723	12052	-	Klebsiella_pneumoniae_KpnF	1-330/330	===============	0/0	100.00	100.00	card	AP006725.1:2484238-2484568	KpnF subunit of KpnEF resembles EbrAB from E. coli. Mutation in KpnEF resulted in increased susceptibility to cefepime ceftriaxon colistin erythromycin rifampin tetracycline and streptomycin as well as enhanced sensitivity toward sodium dodecyl sulfate deoxycholate dyes benzalkonium chloride chlorhexidine and triclosan.	aminoglycoside;cephalosporin;macrolide;peptide;rifamycin;tetracycline
573.12862_contigs.fasta	573.12862_C9	12039	12401	-	Klebsiella_pneumoniae_KpnE	1-363/363	===============	0/0	100.00	99.45	card	AP006725.1:2483889-2484252	KpnE subunit of KpnEF resembles EbrAB from E. coli. Mutation in KpnEF resulted in increased susceptibility to cefepime ceftriaxon colistin erythromycin rifampin tetracycline and streptomycin as well as enhanced sensitivity toward sodium dodecyl sulfate deoxycholate dyes benzalkonium chloride chlorhexidine and triclosan	aminoglycoside;cephalosporin;macrolide;peptide;rifamycin;tetracycline
573.12862_contigs.fasta	573.12862_C9	139607	140761	+	Klebsiella_pneumoniae_OmpK37	1-1125/1125	========/======	7/32	99.91	95.24	card	AJ011502.1:300-1425	Klebsiella pneumoniae outer membrane porin protein. Is preferentially detected in porin-deficient strains. Functional characterization of this new porin revealed a narrower pore than those of porins OmpK35 and OmpK36 which did not allow penetration by certain beta-lactams. Also when a resistant strain expresses porin OmpK37 is less susceptible to cefotaxime and cefoxitin than when it is expressing either OmpK36 or OmpK35.	carbapenem;cephalosporin;cephamycin;monobactam;penam;penem
